No.     Time           Source                Destination           Protocol Length Info
      1 0.000000       127.0.0.1             127.0.0.1             TCP      74     47634 → 10000 [SYN] Seq=0 Win=65495 Len=0 MSS=65495 SACK_PERM=1 TSval=245475351 TSecr=0 WS=128

Frame 1: 74 bytes on wire (592 bits), 74 bytes captured (592 bits)
Ethernet II, Src: 00:00:00_00:00:00 (00:00:00:00:00:00), Dst: 00:00:00_00:00:00 (00:00:00:00:00:00)
Internet Protocol Version 4, Src: 127.0.0.1, Dst: 127.0.0.1
Transmission Control Protocol, Src Port: 47634, Dst Port: 10000, Seq: 0, Len: 0

No.     Time           Source                Destination           Protocol Length Info
      2 0.000009       127.0.0.1             127.0.0.1             TCP      74     10000 → 47634 [SYN, ACK] Seq=0 Ack=1 Win=65483 Len=0 MSS=65495 SACK_PERM=1 TSval=245475351 TSecr=245475351 WS=128

Frame 2: 74 bytes on wire (592 bits), 74 bytes captured (592 bits)
Ethernet II, Src: 00:00:00_00:00:00 (00:00:00:00:00:00), Dst: 00:00:00_00:00:00 (00:00:00:00:00:00)
Internet Protocol Version 4, Src: 127.0.0.1, Dst: 127.0.0.1
Transmission Control Protocol, Src Port: 10000, Dst Port: 47634, Seq: 0, Ack: 1, Len: 0

No.     Time           Source                Destination           Protocol Length Info
      3 0.000015       127.0.0.1             127.0.0.1             TCP      66     47634 → 10000 [ACK] Seq=1 Ack=1 Win=65536 Len=0 TSval=245475351 TSecr=245475351

Frame 3: 66 bytes on wire (528 bits), 66 bytes captured (528 bits)
Ethernet II, Src: 00:00:00_00:00:00 (00:00:00:00:00:00), Dst: 00:00:00_00:00:00 (00:00:00:00:00:00)
Internet Protocol Version 4, Src: 127.0.0.1, Dst: 127.0.0.1
Transmission Control Protocol, Src Port: 47634, Dst Port: 10000, Seq: 1, Ack: 1, Len: 0

No.     Time           Source                Destination           Protocol Length Info
      4 7.580379       127.0.0.1             127.0.0.1             TCP      70     47634 → 10000 [PSH, ACK] Seq=1 Ack=1 Win=65536 Len=4 TSval=245482931 TSecr=245475351

Frame 4: 70 bytes on wire (560 bits), 70 bytes captured (560 bits)
Ethernet II, Src: 00:00:00_00:00:00 (00:00:00:00:00:00), Dst: 00:00:00_00:00:00 (00:00:00:00:00:00)
Internet Protocol Version 4, Src: 127.0.0.1, Dst: 127.0.0.1
Transmission Control Protocol, Src Port: 47634, Dst Port: 10000, Seq: 1, Ack: 1, Len: 4
Data (4 bytes)

0000  74 65 73 74                                       test

No.     Time           Source                Destination           Protocol Length Info
      5 7.580388       127.0.0.1             127.0.0.1             TCP      66     10000 → 47634 [ACK] Seq=1 Ack=5 Win=65536 Len=0 TSval=245482931 TSecr=245482931

Frame 5: 66 bytes on wire (528 bits), 66 bytes captured (528 bits)
Ethernet II, Src: 00:00:00_00:00:00 (00:00:00:00:00:00), Dst: 00:00:00_00:00:00 (00:00:00:00:00:00)
Internet Protocol Version 4, Src: 127.0.0.1, Dst: 127.0.0.1
Transmission Control Protocol, Src Port: 10000, Dst Port: 47634, Seq: 1, Ack: 5, Len: 0

No.     Time           Source                Destination           Protocol Length Info
      6 7.580443       127.0.0.1             127.0.0.1             TCP      75     10000 → 47634 [PSH, ACK] Seq=1 Ack=5 Win=65536 Len=9 TSval=245482931 TSecr=245482931

Frame 6: 75 bytes on wire (600 bits), 75 bytes captured (600 bits)
Ethernet II, Src: 00:00:00_00:00:00 (00:00:00:00:00:00), Dst: 00:00:00_00:00:00 (00:00:00:00:00:00)
Internet Protocol Version 4, Src: 127.0.0.1, Dst: 127.0.0.1
Transmission Control Protocol, Src Port: 10000, Dst Port: 47634, Seq: 1, Ack: 5, Len: 9
Data (9 bytes)

0000  41 63 63 65 70 74 65 64 2e                        Accepted.

No.     Time           Source                Destination           Protocol Length Info
      7 7.580447       127.0.0.1             127.0.0.1             TCP      66     47634 → 10000 [ACK] Seq=5 Ack=10 Win=65536 Len=0 TSval=245482931 TSecr=245482931

Frame 7: 66 bytes on wire (528 bits), 66 bytes captured (528 bits)
Ethernet II, Src: 00:00:00_00:00:00 (00:00:00:00:00:00), Dst: 00:00:00_00:00:00 (00:00:00:00:00:00)
Internet Protocol Version 4, Src: 127.0.0.1, Dst: 127.0.0.1
Transmission Control Protocol, Src Port: 47634, Dst Port: 10000, Seq: 5, Ack: 10, Len: 0

No.     Time           Source                Destination           Protocol Length Info
      8 7.580458       127.0.0.1             127.0.0.1             TCP      86     10000 → 47634 [PSH, ACK] Seq=10 Ack=5 Win=65536 Len=20 TSval=245482931 TSecr=245482931

Frame 8: 86 bytes on wire (688 bits), 86 bytes captured (688 bits)
Ethernet II, Src: 00:00:00_00:00:00 (00:00:00:00:00:00), Dst: 00:00:00_00:00:00 (00:00:00:00:00:00)
Internet Protocol Version 4, Src: 127.0.0.1, Dst: 127.0.0.1
Transmission Control Protocol, Src Port: 10000, Dst Port: 47634, Seq: 10, Ack: 5, Len: 20
Data (20 bytes)

0000  74 65 73 74 20 6a 6f 69 6e 65 64 20 74 68 65 20   test joined the 
0010  63 68 61 74                                       chat

No.     Time           Source                Destination           Protocol Length Info
      9 7.580461       127.0.0.1             127.0.0.1             TCP      66     47634 → 10000 [ACK] Seq=5 Ack=30 Win=65536 Len=0 TSval=245482931 TSecr=245482931

Frame 9: 66 bytes on wire (528 bits), 66 bytes captured (528 bits)
Ethernet II, Src: 00:00:00_00:00:00 (00:00:00:00:00:00), Dst: 00:00:00_00:00:00 (00:00:00:00:00:00)
Internet Protocol Version 4, Src: 127.0.0.1, Dst: 127.0.0.1
Transmission Control Protocol, Src Port: 47634, Dst Port: 10000, Seq: 5, Ack: 30, Len: 0

No.     Time           Source                Destination           Protocol Length Info
     10 9.272321       127.0.0.1             127.0.0.1             TCP      72     47634 → 10000 [PSH, ACK] Seq=5 Ack=30 Win=65536 Len=6 TSval=245484623 TSecr=245482931

Frame 10: 72 bytes on wire (576 bits), 72 bytes captured (576 bits)
Ethernet II, Src: 00:00:00_00:00:00 (00:00:00:00:00:00), Dst: 00:00:00_00:00:00 (00:00:00:00:00:00)
Internet Protocol Version 4, Src: 127.0.0.1, Dst: 127.0.0.1
Transmission Control Protocol, Src Port: 47634, Dst Port: 10000, Seq: 5, Ack: 30, Len: 6
Data (6 bytes)

0000  3f 6e 61 6d 65 73                                 ?names

No.     Time           Source                Destination           Protocol Length Info
     11 9.272370       127.0.0.1             127.0.0.1             TCP      82     10000 → 47634 [PSH, ACK] Seq=30 Ack=11 Win=65536 Len=16 TSval=245484623 TSecr=245484623

Frame 11: 82 bytes on wire (656 bits), 82 bytes captured (656 bits)
Ethernet II, Src: 00:00:00_00:00:00 (00:00:00:00:00:00), Dst: 00:00:00_00:00:00 (00:00:00:00:00:00)
Internet Protocol Version 4, Src: 127.0.0.1, Dst: 127.0.0.1
Transmission Control Protocol, Src Port: 10000, Dst Port: 47634, Seq: 30, Ack: 11, Len: 16
Data (16 bytes)

0000  41 63 63 6f 75 6e 74 73 3a 20 74 65 73 74 2c 20   Accounts: test, 

No.     Time           Source                Destination           Protocol Length Info
     12 9.272377       127.0.0.1             127.0.0.1             TCP      66     47634 → 10000 [ACK] Seq=11 Ack=46 Win=65536 Len=0 TSval=245484623 TSecr=245484623

Frame 12: 66 bytes on wire (528 bits), 66 bytes captured (528 bits)
Ethernet II, Src: 00:00:00_00:00:00 (00:00:00:00:00:00), Dst: 00:00:00_00:00:00 (00:00:00:00:00:00)
Internet Protocol Version 4, Src: 127.0.0.1, Dst: 127.0.0.1
Transmission Control Protocol, Src Port: 47634, Dst Port: 10000, Seq: 11, Ack: 46, Len: 0

No.     Time           Source                Destination           Protocol Length Info
     13 15.844720      127.0.0.1             127.0.0.1             TCP      74     47634 → 10000 [PSH, ACK] Seq=11 Ack=46 Win=65536 Len=8 TSval=245491195 TSecr=245484623

Frame 13: 74 bytes on wire (592 bits), 74 bytes captured (592 bits)
Ethernet II, Src: 00:00:00_00:00:00 (00:00:00:00:00:00), Dst: 00:00:00_00:00:00 (00:00:00:00:00:00)
Internet Protocol Version 4, Src: 127.0.0.1, Dst: 127.0.0.1
Transmission Control Protocol, Src Port: 47634, Dst Port: 10000, Seq: 11, Ack: 46, Len: 8
Data (8 bytes)

0000  64 67 64 66 67 66 64 67                           dgdfgfdg

No.     Time           Source                Destination           Protocol Length Info
     14 15.844847      127.0.0.1             127.0.0.1             TCP      81     10000 → 47634 [PSH, ACK] Seq=46 Ack=19 Win=65536 Len=15 TSval=245491196 TSecr=245491195

Frame 14: 81 bytes on wire (648 bits), 81 bytes captured (648 bits)
Ethernet II, Src: 00:00:00_00:00:00 (00:00:00:00:00:00), Dst: 00:00:00_00:00:00 (00:00:00:00:00:00)
Internet Protocol Version 4, Src: 127.0.0.1, Dst: 127.0.0.1
Transmission Control Protocol, Src Port: 10000, Dst Port: 47634, Seq: 46, Ack: 19, Len: 15
Data (15 bytes)

0000  0a 74 65 73 74 3a 20 64 67 64 66 67 66 64 67      .test: dgdfgfdg

No.     Time           Source                Destination           Protocol Length Info
     15 15.844857      127.0.0.1             127.0.0.1             TCP      66     47634 → 10000 [ACK] Seq=19 Ack=61 Win=65536 Len=0 TSval=245491196 TSecr=245491196

Frame 15: 66 bytes on wire (528 bits), 66 bytes captured (528 bits)
Ethernet II, Src: 00:00:00_00:00:00 (00:00:00:00:00:00), Dst: 00:00:00_00:00:00 (00:00:00:00:00:00)
Internet Protocol Version 4, Src: 127.0.0.1, Dst: 127.0.0.1
Transmission Control Protocol, Src Port: 47634, Dst Port: 10000, Seq: 19, Ack: 61, Len: 0

No.     Time           Source                Destination           Protocol Length Info
     16 25.767467      127.0.0.1             127.0.0.1             TCP      74     47636 → 10000 [SYN] Seq=0 Win=65495 Len=0 MSS=65495 SACK_PERM=1 TSval=245501118 TSecr=0 WS=128

Frame 16: 74 bytes on wire (592 bits), 74 bytes captured (592 bits)
Ethernet II, Src: 00:00:00_00:00:00 (00:00:00:00:00:00), Dst: 00:00:00_00:00:00 (00:00:00:00:00:00)
Internet Protocol Version 4, Src: 127.0.0.1, Dst: 127.0.0.1
Transmission Control Protocol, Src Port: 47636, Dst Port: 10000, Seq: 0, Len: 0

No.     Time           Source                Destination           Protocol Length Info
     17 25.767476      127.0.0.1             127.0.0.1             TCP      74     10000 → 47636 [SYN, ACK] Seq=0 Ack=1 Win=65483 Len=0 MSS=65495 SACK_PERM=1 TSval=245501118 TSecr=245501118 WS=128

Frame 17: 74 bytes on wire (592 bits), 74 bytes captured (592 bits)
Ethernet II, Src: 00:00:00_00:00:00 (00:00:00:00:00:00), Dst: 00:00:00_00:00:00 (00:00:00:00:00:00)
Internet Protocol Version 4, Src: 127.0.0.1, Dst: 127.0.0.1
Transmission Control Protocol, Src Port: 10000, Dst Port: 47636, Seq: 0, Ack: 1, Len: 0

No.     Time           Source                Destination           Protocol Length Info
     18 25.767484      127.0.0.1             127.0.0.1             TCP      66     47636 → 10000 [ACK] Seq=1 Ack=1 Win=65536 Len=0 TSval=245501118 TSecr=245501118

Frame 18: 66 bytes on wire (528 bits), 66 bytes captured (528 bits)
Ethernet II, Src: 00:00:00_00:00:00 (00:00:00:00:00:00), Dst: 00:00:00_00:00:00 (00:00:00:00:00:00)
Internet Protocol Version 4, Src: 127.0.0.1, Dst: 127.0.0.1
Transmission Control Protocol, Src Port: 47636, Dst Port: 10000, Seq: 1, Ack: 1, Len: 0

No.     Time           Source                Destination           Protocol Length Info
     19 32.560519      127.0.0.1             127.0.0.1             TCP      71     47636 → 10000 [PSH, ACK] Seq=1 Ack=1 Win=65536 Len=5 TSval=245507911 TSecr=245501118

Frame 19: 71 bytes on wire (568 bits), 71 bytes captured (568 bits)
Ethernet II, Src: 00:00:00_00:00:00 (00:00:00:00:00:00), Dst: 00:00:00_00:00:00 (00:00:00:00:00:00)
Internet Protocol Version 4, Src: 127.0.0.1, Dst: 127.0.0.1
Transmission Control Protocol, Src Port: 47636, Dst Port: 10000, Seq: 1, Ack: 1, Len: 5
Data (5 bytes)

0000  74 65 73 74 32                                    test2

No.     Time           Source                Destination           Protocol Length Info
     20 32.560529      127.0.0.1             127.0.0.1             TCP      66     10000 → 47636 [ACK] Seq=1 Ack=6 Win=65536 Len=0 TSval=245507911 TSecr=245507911

Frame 20: 66 bytes on wire (528 bits), 66 bytes captured (528 bits)
Ethernet II, Src: 00:00:00_00:00:00 (00:00:00:00:00:00), Dst: 00:00:00_00:00:00 (00:00:00:00:00:00)
Internet Protocol Version 4, Src: 127.0.0.1, Dst: 127.0.0.1
Transmission Control Protocol, Src Port: 10000, Dst Port: 47636, Seq: 1, Ack: 6, Len: 0

No.     Time           Source                Destination           Protocol Length Info
     21 32.560589      127.0.0.1             127.0.0.1             TCP      75     10000 → 47636 [PSH, ACK] Seq=1 Ack=6 Win=65536 Len=9 TSval=245507911 TSecr=245507911

Frame 21: 75 bytes on wire (600 bits), 75 bytes captured (600 bits)
Ethernet II, Src: 00:00:00_00:00:00 (00:00:00:00:00:00), Dst: 00:00:00_00:00:00 (00:00:00:00:00:00)
Internet Protocol Version 4, Src: 127.0.0.1, Dst: 127.0.0.1
Transmission Control Protocol, Src Port: 10000, Dst Port: 47636, Seq: 1, Ack: 6, Len: 9
Data (9 bytes)

0000  41 63 63 65 70 74 65 64 2e                        Accepted.

No.     Time           Source                Destination           Protocol Length Info
     22 32.560595      127.0.0.1             127.0.0.1             TCP      66     47636 → 10000 [ACK] Seq=6 Ack=10 Win=65536 Len=0 TSval=245507911 TSecr=245507911

Frame 22: 66 bytes on wire (528 bits), 66 bytes captured (528 bits)
Ethernet II, Src: 00:00:00_00:00:00 (00:00:00:00:00:00), Dst: 00:00:00_00:00:00 (00:00:00:00:00:00)
Internet Protocol Version 4, Src: 127.0.0.1, Dst: 127.0.0.1
Transmission Control Protocol, Src Port: 47636, Dst Port: 10000, Seq: 6, Ack: 10, Len: 0

No.     Time           Source                Destination           Protocol Length Info
     23 32.560608      127.0.0.1             127.0.0.1             TCP      87     10000 → 47634 [PSH, ACK] Seq=61 Ack=19 Win=65536 Len=21 TSval=245507911 TSecr=245491196

Frame 23: 87 bytes on wire (696 bits), 87 bytes captured (696 bits)
Ethernet II, Src: 00:00:00_00:00:00 (00:00:00:00:00:00), Dst: 00:00:00_00:00:00 (00:00:00:00:00:00)
Internet Protocol Version 4, Src: 127.0.0.1, Dst: 127.0.0.1
Transmission Control Protocol, Src Port: 10000, Dst Port: 47634, Seq: 61, Ack: 19, Len: 21
Data (21 bytes)

0000  74 65 73 74 32 20 6a 6f 69 6e 65 64 20 74 68 65   test2 joined the
0010  20 63 68 61 74                                     chat

No.     Time           Source                Destination           Protocol Length Info
     24 32.560612      127.0.0.1             127.0.0.1             TCP      66     47634 → 10000 [ACK] Seq=19 Ack=82 Win=65536 Len=0 TSval=245507911 TSecr=245507911

Frame 24: 66 bytes on wire (528 bits), 66 bytes captured (528 bits)
Ethernet II, Src: 00:00:00_00:00:00 (00:00:00:00:00:00), Dst: 00:00:00_00:00:00 (00:00:00:00:00:00)
Internet Protocol Version 4, Src: 127.0.0.1, Dst: 127.0.0.1
Transmission Control Protocol, Src Port: 47634, Dst Port: 10000, Seq: 19, Ack: 82, Len: 0

No.     Time           Source                Destination           Protocol Length Info
     25 32.560616      127.0.0.1             127.0.0.1             TCP      87     10000 → 47636 [PSH, ACK] Seq=10 Ack=6 Win=65536 Len=21 TSval=245507911 TSecr=245507911

Frame 25: 87 bytes on wire (696 bits), 87 bytes captured (696 bits)
Ethernet II, Src: 00:00:00_00:00:00 (00:00:00:00:00:00), Dst: 00:00:00_00:00:00 (00:00:00:00:00:00)
Internet Protocol Version 4, Src: 127.0.0.1, Dst: 127.0.0.1
Transmission Control Protocol, Src Port: 10000, Dst Port: 47636, Seq: 10, Ack: 6, Len: 21
Data (21 bytes)

0000  74 65 73 74 32 20 6a 6f 69 6e 65 64 20 74 68 65   test2 joined the
0010  20 63 68 61 74                                     chat

No.     Time           Source                Destination           Protocol Length Info
     26 32.560618      127.0.0.1             127.0.0.1             TCP      66     47636 → 10000 [ACK] Seq=6 Ack=31 Win=65536 Len=0 TSval=245507911 TSecr=245507911

Frame 26: 66 bytes on wire (528 bits), 66 bytes captured (528 bits)
Ethernet II, Src: 00:00:00_00:00:00 (00:00:00:00:00:00), Dst: 00:00:00_00:00:00 (00:00:00:00:00:00)
Internet Protocol Version 4, Src: 127.0.0.1, Dst: 127.0.0.1
Transmission Control Protocol, Src Port: 47636, Dst Port: 10000, Seq: 6, Ack: 31, Len: 0

No.     Time           Source                Destination           Protocol Length Info
     27 36.280824      127.0.0.1             127.0.0.1             TCP      73     47636 → 10000 [PSH, ACK] Seq=6 Ack=31 Win=65536 Len=7 TSval=245511632 TSecr=245507911

Frame 27: 73 bytes on wire (584 bits), 73 bytes captured (584 bits)
Ethernet II, Src: 00:00:00_00:00:00 (00:00:00:00:00:00), Dst: 00:00:00_00:00:00 (00:00:00:00:00:00)
Internet Protocol Version 4, Src: 127.0.0.1, Dst: 127.0.0.1
Transmission Control Protocol, Src Port: 47636, Dst Port: 10000, Seq: 6, Ack: 31, Len: 7
Data (7 bytes)

0000  63 78 76 62 63 78 62                              cxvbcxb

No.     Time           Source                Destination           Protocol Length Info
     28 36.280932      127.0.0.1             127.0.0.1             TCP      81     10000 → 47634 [PSH, ACK] Seq=82 Ack=19 Win=65536 Len=15 TSval=245511632 TSecr=245507911

Frame 28: 81 bytes on wire (648 bits), 81 bytes captured (648 bits)
Ethernet II, Src: 00:00:00_00:00:00 (00:00:00:00:00:00), Dst: 00:00:00_00:00:00 (00:00:00:00:00:00)
Internet Protocol Version 4, Src: 127.0.0.1, Dst: 127.0.0.1
Transmission Control Protocol, Src Port: 10000, Dst Port: 47634, Seq: 82, Ack: 19, Len: 15
Data (15 bytes)

0000  0a 74 65 73 74 32 3a 20 63 78 76 62 63 78 62      .test2: cxvbcxb

No.     Time           Source                Destination           Protocol Length Info
     29 36.280939      127.0.0.1             127.0.0.1             TCP      66     47634 → 10000 [ACK] Seq=19 Ack=97 Win=65536 Len=0 TSval=245511632 TSecr=245511632

Frame 29: 66 bytes on wire (528 bits), 66 bytes captured (528 bits)
Ethernet II, Src: 00:00:00_00:00:00 (00:00:00:00:00:00), Dst: 00:00:00_00:00:00 (00:00:00:00:00:00)
Internet Protocol Version 4, Src: 127.0.0.1, Dst: 127.0.0.1
Transmission Control Protocol, Src Port: 47634, Dst Port: 10000, Seq: 19, Ack: 97, Len: 0

No.     Time           Source                Destination           Protocol Length Info
     30 36.280949      127.0.0.1             127.0.0.1             TCP      81     10000 → 47636 [PSH, ACK] Seq=31 Ack=13 Win=65536 Len=15 TSval=245511632 TSecr=245511632

Frame 30: 81 bytes on wire (648 bits), 81 bytes captured (648 bits)
Ethernet II, Src: 00:00:00_00:00:00 (00:00:00:00:00:00), Dst: 00:00:00_00:00:00 (00:00:00:00:00:00)
Internet Protocol Version 4, Src: 127.0.0.1, Dst: 127.0.0.1
Transmission Control Protocol, Src Port: 10000, Dst Port: 47636, Seq: 31, Ack: 13, Len: 15
Data (15 bytes)

0000  0a 74 65 73 74 32 3a 20 63 78 76 62 63 78 62      .test2: cxvbcxb

No.     Time           Source                Destination           Protocol Length Info
     31 36.280955      127.0.0.1             127.0.0.1             TCP      66     47636 → 10000 [ACK] Seq=13 Ack=46 Win=65536 Len=0 TSval=245511632 TSecr=245511632

Frame 31: 66 bytes on wire (528 bits), 66 bytes captured (528 bits)
Ethernet II, Src: 00:00:00_00:00:00 (00:00:00:00:00:00), Dst: 00:00:00_00:00:00 (00:00:00:00:00:00)
Internet Protocol Version 4, Src: 127.0.0.1, Dst: 127.0.0.1
Transmission Control Protocol, Src Port: 47636, Dst Port: 10000, Seq: 13, Ack: 46, Len: 0

No.     Time           Source                Destination           Protocol Length Info
     32 39.574226      127.0.0.1             127.0.0.1             TCP      71     47636 → 10000 [PSH, ACK] Seq=13 Ack=46 Win=65536 Len=5 TSval=245514925 TSecr=245511632

Frame 32: 71 bytes on wire (568 bits), 71 bytes captured (568 bits)
Ethernet II, Src: 00:00:00_00:00:00 (00:00:00:00:00:00), Dst: 00:00:00_00:00:00 (00:00:00:00:00:00)
Internet Protocol Version 4, Src: 127.0.0.1, Dst: 127.0.0.1
Transmission Control Protocol, Src Port: 47636, Dst Port: 10000, Seq: 13, Ack: 46, Len: 5
Data (5 bytes)

0000  63 78 76 78 63                                    cxvxc

No.     Time           Source                Destination           Protocol Length Info
     33 39.574299      127.0.0.1             127.0.0.1             TCP      79     10000 → 47634 [PSH, ACK] Seq=97 Ack=19 Win=65536 Len=13 TSval=245514925 TSecr=245511632

Frame 33: 79 bytes on wire (632 bits), 79 bytes captured (632 bits)
Ethernet II, Src: 00:00:00_00:00:00 (00:00:00:00:00:00), Dst: 00:00:00_00:00:00 (00:00:00:00:00:00)
Internet Protocol Version 4, Src: 127.0.0.1, Dst: 127.0.0.1
Transmission Control Protocol, Src Port: 10000, Dst Port: 47634, Seq: 97, Ack: 19, Len: 13
Data (13 bytes)

0000  0a 74 65 73 74 32 3a 20 63 78 76 78 63            .test2: cxvxc

No.     Time           Source                Destination           Protocol Length Info
     34 39.574305      127.0.0.1             127.0.0.1             TCP      66     47634 → 10000 [ACK] Seq=19 Ack=110 Win=65536 Len=0 TSval=245514925 TSecr=245514925

Frame 34: 66 bytes on wire (528 bits), 66 bytes captured (528 bits)
Ethernet II, Src: 00:00:00_00:00:00 (00:00:00:00:00:00), Dst: 00:00:00_00:00:00 (00:00:00:00:00:00)
Internet Protocol Version 4, Src: 127.0.0.1, Dst: 127.0.0.1
Transmission Control Protocol, Src Port: 47634, Dst Port: 10000, Seq: 19, Ack: 110, Len: 0

No.     Time           Source                Destination           Protocol Length Info
     35 39.574314      127.0.0.1             127.0.0.1             TCP      79     10000 → 47636 [PSH, ACK] Seq=46 Ack=18 Win=65536 Len=13 TSval=245514925 TSecr=245514925

Frame 35: 79 bytes on wire (632 bits), 79 bytes captured (632 bits)
Ethernet II, Src: 00:00:00_00:00:00 (00:00:00:00:00:00), Dst: 00:00:00_00:00:00 (00:00:00:00:00:00)
Internet Protocol Version 4, Src: 127.0.0.1, Dst: 127.0.0.1
Transmission Control Protocol, Src Port: 10000, Dst Port: 47636, Seq: 46, Ack: 18, Len: 13
Data (13 bytes)

0000  0a 74 65 73 74 32 3a 20 63 78 76 78 63            .test2: cxvxc

No.     Time           Source                Destination           Protocol Length Info
     36 39.574319      127.0.0.1             127.0.0.1             TCP      66     47636 → 10000 [ACK] Seq=18 Ack=59 Win=65536 Len=0 TSval=245514925 TSecr=245514925

Frame 36: 66 bytes on wire (528 bits), 66 bytes captured (528 bits)
Ethernet II, Src: 00:00:00_00:00:00 (00:00:00:00:00:00), Dst: 00:00:00_00:00:00 (00:00:00:00:00:00)
Internet Protocol Version 4, Src: 127.0.0.1, Dst: 127.0.0.1
Transmission Control Protocol, Src Port: 47636, Dst Port: 10000, Seq: 18, Ack: 59, Len: 0

No.     Time           Source                Destination           Protocol Length Info
     37 42.048577      127.0.0.1             127.0.0.1             TCP      72     47636 → 10000 [PSH, ACK] Seq=18 Ack=59 Win=65536 Len=6 TSval=245517399 TSecr=245514925

Frame 37: 72 bytes on wire (576 bits), 72 bytes captured (576 bits)
Ethernet II, Src: 00:00:00_00:00:00 (00:00:00:00:00:00), Dst: 00:00:00_00:00:00 (00:00:00:00:00:00)
Internet Protocol Version 4, Src: 127.0.0.1, Dst: 127.0.0.1
Transmission Control Protocol, Src Port: 47636, Dst Port: 10000, Seq: 18, Ack: 59, Len: 6
Data (6 bytes)

0000  3f 6e 61 6d 65 73                                 ?names

No.     Time           Source                Destination           Protocol Length Info
     38 42.048662      127.0.0.1             127.0.0.1             TCP      89     10000 → 47636 [PSH, ACK] Seq=59 Ack=24 Win=65536 Len=23 TSval=245517399 TSecr=245517399

Frame 38: 89 bytes on wire (712 bits), 89 bytes captured (712 bits)
Ethernet II, Src: 00:00:00_00:00:00 (00:00:00:00:00:00), Dst: 00:00:00_00:00:00 (00:00:00:00:00:00)
Internet Protocol Version 4, Src: 127.0.0.1, Dst: 127.0.0.1
Transmission Control Protocol, Src Port: 10000, Dst Port: 47636, Seq: 59, Ack: 24, Len: 23
Data (23 bytes)

0000  41 63 63 6f 75 6e 74 73 3a 20 74 65 73 74 2c 20   Accounts: test, 
0010  74 65 73 74 32 2c 20                              test2, 

No.     Time           Source                Destination           Protocol Length Info
     39 42.048690      127.0.0.1             127.0.0.1             TCP      66     47636 → 10000 [ACK] Seq=24 Ack=82 Win=65536 Len=0 TSval=245517399 TSecr=245517399

Frame 39: 66 bytes on wire (528 bits), 66 bytes captured (528 bits)
Ethernet II, Src: 00:00:00_00:00:00 (00:00:00:00:00:00), Dst: 00:00:00_00:00:00 (00:00:00:00:00:00)
Internet Protocol Version 4, Src: 127.0.0.1, Dst: 127.0.0.1
Transmission Control Protocol, Src Port: 47636, Dst Port: 10000, Seq: 24, Ack: 82, Len: 0
